{
  "schema_version": "1.0.0",
  "manifest_id": "manifest_imgreq_hangzhou_cover_style_test",
  "request_id": "imgreq_hangzhou_cover_style_test",
  "source_document": {
    "document_type": "travel_plan",
    "document_id": "hangzhou_cover_style_test",
    "document_version": "2.0.0",
    "source_ref": "C:\\Users\\10200\\Desktop\\image-pipeline\\image-pipeline\\input\\hangzhou_cover_style_test.json"
  },
  "created_at": "2026-01-01T00:00:10.000Z",
  "updated_at": "2026-01-01T00:00:10.000Z",
  "assets": [
    {
      "asset_id": "asset_trip_hangzhou_cover_style_test",
      "asset_request_id": "assetreq_trip_hangzhou_cover_style_test",
      "asset_role": "cover",
      "status": "completed",
      "subject_snapshot": {
        "entity_type": "trip",
        "entity_id": "trip_hangzhou_cover_style_test",
        "entity_ref": "trip://hangzhou_cover_style_test",
        "title": "Hangzhou Personal Travel Journal Cover",
        "location_name": "West Lake"
      },
      "provider": {
        "provider_id": "seedream",
        "provider_label": "seedream",
        "model_id": "doubao-seedream-5-0-pro-260628",
        "model_label": "doubao-seedream-5-0-pro-260628"
      },
      "generation": {
        "submitted_at": "2026-07-16T06:27:14.886Z",
        "completed_at": "2026-07-16T06:28:55.035Z",
        "duration_ms": 100149,
        "provider_request_id": "seedream_assetreq_trip_hangzhou_cover_style_test",
        "size": {
          "width": 1080,
          "height": 1350
        },
        "parameters": {
          "asset_role": "cover",
          "style_profile_id": "wanderly_personal_travel_journal_cover_v2",
          "aspect_ratio": "4:5",
          "orientation": "portrait",
          "prompt": "A personalized travel journal cover illustration for Hangzhou Personal Travel Journal Cover. Destination context: Hangzhou, China. Scene idea: A quiet Hangzhou lakeside mood with broad water and sky, one simple focal scene, and a poetic private travel journal feeling. Style profile: wanderly_personal_travel_journal_cover_v2. Use a light-toned, low-saturation watercolor palette with muted gray-blue, rice white, and pale soft green. Emphasize an oriental watercolor travel journal mood with textured watercolor paper, soft ink wash, visible paper grain, and gently blurred edges. Keep the composition simple and sparse with one single visual focus, large negative space, and broad open areas of lake, sky, or paper-like blank space. Prefer a quiet poetic atmosphere, private and intimate rather than commercial, with soft calm light and restrained detail. Only a few delicate accents are allowed, such as a small pavilion, a tiny boat, lotus, or willow branches. Avoid multiple landmarks, avoid dense storytelling, avoid crowded elements, avoid high saturation, avoid strong contrast, avoid sharp digital illustration feeling, avoid game concept art feeling, avoid tourism poster feeling. No text, no letters, no typography, no watermark, no logo.",
          "response_format": "b64_json",
          "requested_variants": 3,
          "revised_prompts": []
        }
      },
      "files": [
        {
          "file_kind": "generated_image",
          "storage_ref": "C:\\Users\\10200\\Desktop\\image-pipeline\\image-pipeline\\output\\runs\\hangzhou_cover_style_test\\generated\\cover_001.png",
          "mime_type": "image/png",
          "width": 1080,
          "height": 1350,
          "size_bytes": 234207
        }
      ],
      "review": {
        "status": "pending",
        "notes": "Initialized by manifest writer stub."
      },
      "metadata": {
        "priority": 1,
        "variants_requested": 3
      }
    }
  ],
  "metadata": {
    "manifest_builder_version": "phase1-manifest-writer-stub",
    "provider_id": "seedream",
    "model_id": "doubao-seedream-5-0-pro-260628"
  }
}
