{
  "schema_version": "1.0.0",
  "manifest_id": "manifest_imgreq_hangzhou_cover_test",
  "request_id": "imgreq_hangzhou_cover_test",
  "source_document": {
    "document_type": "travel_plan",
    "document_id": "hangzhou_cover_test",
    "document_version": "2.0.0",
    "source_ref": "C:\\Users\\10200\\Desktop\\image-pipeline\\image-pipeline\\input\\hangzhou_cover_test.json"
  },
  "created_at": "2026-01-01T00:00:10.000Z",
  "updated_at": "2026-01-01T00:00:10.000Z",
  "assets": [
    {
      "asset_id": "asset_trip_hangzhou_cover_test",
      "asset_request_id": "assetreq_trip_hangzhou_cover_test",
      "asset_role": "cover",
      "status": "completed",
      "subject_snapshot": {
        "entity_type": "trip",
        "entity_id": "trip_hangzhou_cover_test",
        "entity_ref": "trip://hangzhou_cover_test",
        "title": "Hangzhou Lakeside Weekend Journal",
        "location_name": "West Lake"
      },
      "provider": {
        "provider_id": "seedream",
        "provider_label": "seedream",
        "model_id": "doubao-seedream-5-0-pro-260628",
        "model_label": "doubao-seedream-5-0-pro-260628"
      },
      "generation": {
        "submitted_at": "2026-07-16T05:32:15.231Z",
        "completed_at": "2026-07-16T05:34:19.740Z",
        "duration_ms": 124509,
        "provider_request_id": "seedream_assetreq_trip_hangzhou_cover_test",
        "size": {
          "width": 1080,
          "height": 1350
        },
        "parameters": {
          "asset_role": "cover",
          "style_profile_id": "wanderly_editorial_travel_v1",
          "aspect_ratio": "4:5",
          "orientation": "portrait",
          "prompt": "A light-toned watercolor travel cover illustration for Hangzhou Lakeside Weekend Journal. Destination context: Hangzhou, China. Scene idea: A soft, dreamy cover centered on West Lake, tea culture, and quiet reflective city moments. Style: soft watercolor, pastel highlights, personalized travel journal aesthetic, elegant hand-crafted composition. Visual direction: airy layout, gentle paper texture feeling, warm and refined editorial cover image. Constraints: no text, no letters, no typography, no watermark, no logo, no frame.",
          "response_format": "b64_json"
        }
      },
      "files": [
        {
          "file_kind": "generated_image",
          "storage_ref": "C:\\Users\\10200\\Desktop\\image-pipeline\\image-pipeline\\output\\runs\\hangzhou_cover_test\\generated\\cover_001.png",
          "mime_type": "image/png",
          "width": 1080,
          "height": 1350,
          "size_bytes": 397326
        }
      ],
      "review": {
        "status": "pending",
        "notes": "Initialized by manifest writer stub."
      },
      "metadata": {
        "priority": 1,
        "variants_requested": 1
      }
    }
  ],
  "metadata": {
    "manifest_builder_version": "phase1-manifest-writer-stub",
    "provider_id": "seedream",
    "model_id": "doubao-seedream-5-0-pro-260628"
  }
}
